;El numero de personas externas asociadas a un proyecto debe ser igual o menor a la cantidad del personal interno.
;Una persona no puede tener mas de tres Features en el mismo periodo de tiempo.
;Una persona no puede superar el 100% de la ocupación en el tiempo actual.
;Una Feature debe ser ejecutada en un periodo máximo de 6 meses.
;Una Feature no puede superar el tiempo destinado para su ejecución.
;El porcentaje de habilidad de la persona seleccionada es inferior al porcentaje de la tecnología requerida para el proyecto.
;La persona seleccionada pertenece a un equipo Scrum, por lo cual su dedicación esta al 100% y no puede participar en mas Features en el mismo periodo de tiempo.
